{
  "format": "coverage",
  "version": "1.3.0",
  "required_rules": [
    "T-1",
    "T-3",
    "T-9",
    "T-11",
    "T-12",
    "T-13",
    "W-3",
    "W-4",
    "W-5",
    "W-6",
    "W-7",
    "W-8",
    "W-9",
    "R-1",
    "R-2",
    "R-3",
    "R-4",
    "R-5",
    "R-6",
    "R-7",
    "R-8",
    "S-1",
    "S-2",
    "S-3",
    "S-4",
    "E-1",
    "E-2",
    "E-3",
    "D-1",
    "D-2",
    "D-3",
    "D-4",
    "D-5",
    "D-6",
    "D-7",
    "D-9",
    "DY-2",
    "DY-3",
    "DY-8",
    "DY-9",
    "DY-10",
    "DY-11",
    "DY-12",
    "DY-16",
    "DY-17",
    "K-1"
  ],
  "exclusions": [
    {
      "rule": "W-5",
      "status": "deleted",
      "reason": "versionの廃止により共通契約3.3で削除済みであり、番号を再利用しない。"
    },
    {
      "rule": "R-7",
      "status": "caller-obligation",
      "reason": "呼び出し側の推奨事項であり、ストアの4操作の適合ケースとしては実行しない。リプレイの最終番号と取得したヘッドを照合する責任は実行器の利用者にある。"
    },
    {
      "rule": "T-5",
      "status": "api-surface",
      "reason": "公開APIの形と、ペイロードの型への要件である。操作の場面では表せず、公開APIの形の照合（ハブのapi-surface/）の範囲である。"
    },
    {
      "rule": "T-6",
      "status": "api-surface",
      "reason": "公開APIの形と、ペイロードの型への要件である。操作の場面では表せず、公開APIの形の照合（ハブのapi-surface/）の範囲である。"
    },
    {
      "rule": "F-1",
      "status": "not-provided",
      "reason": "最初のメジャーは変更フィードを提供しない。"
    },
    {
      "rule": "F-2",
      "status": "not-provided",
      "reason": "最初のメジャーは変更フィードを提供しない。"
    },
    {
      "rule": "F-3",
      "status": "not-provided",
      "reason": "最初のメジャーは変更フィードを提供しない。"
    },
    {
      "rule": "F-4",
      "status": "not-provided",
      "reason": "最初のメジャーは変更フィードを提供しない。"
    },
    {
      "rule": "F-5",
      "status": "not-provided",
      "reason": "最初のメジャーは変更フィードを提供しない。"
    },
    {
      "rule": "DY-13",
      "status": "not-provided",
      "reason": "最初のメジャーは変更フィードを提供しない。"
    },
    {
      "rule": "DY-15",
      "status": "not-provided",
      "reason": "最初のメジャーは変更フィードを提供しない。"
    },
    {
      "rule": "SP-1",
      "status": "profile-documentation",
      "reason": "前提を文書に書くという義務で、操作の場面では表せない。"
    },
    {
      "rule": "DY-18",
      "status": "profile-documentation",
      "reason": "前提を文書に書くという義務で、操作の場面では表せない。"
    },
    {
      "rule": "MEM-1",
      "status": "profile-documentation",
      "reason": "前提を文書に書くという義務で、操作の場面では表せない。"
    },
    {
      "rule": "K-2",
      "status": "no-target-profile",
      "reason": "ハッシュを使う保存先がない。キーへの埋め込み方は、その保存先のプロファイルが定める。"
    },
    {
      "rule": "MEM-4",
      "status": "nondeterministic",
      "reason": "並行の結果が非決定的になる。"
    },
    {
      "rule": "MEM-5",
      "status": "core-scenarios",
      "reason": "共通契約の場面（SP-2、R-1〜R-8、S-1〜S-4など）をメモリで実行して確かめる。メモリ固有の規則番号は場面に付けない。"
    },
    {
      "rule": "MEM-7",
      "status": "core-scenarios",
      "reason": "共通契約の場面（SP-2、R-1〜R-8、S-1〜S-4など）をメモリで実行して確かめる。メモリ固有の規則番号は場面に付けない。"
    },
    {
      "rule": "MEM-8",
      "status": "core-scenarios",
      "reason": "共通契約の場面（SP-2、R-1〜R-8、S-1〜S-4など）をメモリで実行して確かめる。メモリ固有の規則番号は場面に付けない。"
    },
    {
      "rule": "MEM-9",
      "status": "core-scenarios",
      "reason": "共通契約の場面（SP-2、R-1〜R-8、S-1〜S-4など）をメモリで実行して確かめる。メモリ固有の規則番号は場面に付けない。"
    },
    {
      "rule": "MEM-10",
      "status": "core-scenarios",
      "reason": "共通契約の場面（SP-2、R-1〜R-8、S-1〜S-4など）をメモリで実行して確かめる。メモリ固有の規則番号は場面に付けない。"
    },
    {
      "rule": "MEM-11",
      "status": "core-scenarios",
      "reason": "共通契約の場面（SP-2、R-1〜R-8、S-1〜S-4など）をメモリで実行して確かめる。メモリ固有の規則番号は場面に付けない。"
    },
    {
      "rule": "SQ-1",
      "status": "out-of-scope",
      "reason": "接続の設定（SQLiteの版の下限、locking_mode・journal_mode・synchronous、shared cache、busyの待ち時間の既定値、ファイルの置き場）は操作の場面で表せないので、各言語の試験に任せる。busyの待ち時間はstore.lock_wait_millisecondsで明示する。"
    },
    {
      "rule": "SQ-3",
      "status": "core-scenarios",
      "reason": "共通契約の場面（SP-2、R-1〜R-8、S-1〜S-4など）をSQLiteで実行して確かめる。SQLite固有の規則番号は場面に付けない。"
    },
    {
      "rule": "SQ-4",
      "status": "core-scenarios",
      "reason": "共通契約の場面（SP-2、R-1〜R-8、S-1〜S-4など）をSQLiteで実行して確かめる。SQLite固有の規則番号は場面に付けない。"
    },
    {
      "rule": "SQ-5",
      "status": "core-scenarios",
      "reason": "共通契約の場面（SP-2、R-1〜R-8、S-1〜S-4など）をSQLiteで実行して確かめる。SQLite固有の規則番号は場面に付けない。"
    },
    {
      "rule": "SQ-6",
      "status": "core-scenarios",
      "reason": "共通契約の場面（SP-2、R-1〜R-8、S-1〜S-4など）をSQLiteで実行して確かめる。SQLite固有の規則番号は場面に付けない。"
    },
    {
      "rule": "SQ-8",
      "status": "core-scenarios",
      "reason": "共通契約の場面（SP-2、R-1〜R-8、S-1〜S-4など）をSQLiteで実行して確かめる。SQLite固有の規則番号は場面に付けない。"
    },
    {
      "rule": "SQ-9",
      "status": "core-scenarios",
      "reason": "共通契約の場面（SP-2、R-1〜R-8、S-1〜S-4など）をSQLiteで実行して確かめる。SQLite固有の規則番号は場面に付けない。"
    },
    {
      "rule": "SQ-10",
      "status": "core-scenarios",
      "reason": "共通契約の場面（SP-2、R-1〜R-8、S-1〜S-4など）をSQLiteで実行して確かめる。SQLite固有の規則番号は場面に付けない。"
    },
    {
      "rule": "SQ-12",
      "status": "not-provided",
      "reason": "変更フィードは最初の版で提供しない（SQ-20）。head_transitionを追記のトランザクションに含める義務は、フィードを提供するときだけ生じる。"
    },
    {
      "rule": "SQ-14",
      "status": "out-of-scope",
      "reason": "全接続のjournal_modeとsynchronousの設定・確認は操作の場面で表せないので、各言語の試験に任せる。"
    },
    {
      "rule": "SQ-15",
      "status": "out-of-scope",
      "reason": "接続から取得したSQLite本体の版の確認は操作の場面で表せないので、各言語の試験に任せる。"
    },
    {
      "rule": "SQ-16",
      "status": "out-of-scope",
      "reason": "テーブル定義（STRICTの宣言の照合）は操作の場面で表せないので、各言語の試験に任せる。テーブルの形は各言語の試験で確かめる。"
    },
    {
      "rule": "SQ-17",
      "status": "out-of-scope",
      "reason": "BEGIN IMMEDIATEをヘッドの照合の前に開始し、接続を操作間で共有しない義務は、同時に走る競合でしか観測できない。同時実行は共通のデータに入れず、各言語の試験に任せる。"
    },
    {
      "rule": "SQ-18",
      "status": "not-provided",
      "reason": "変更フィードは最初の版で提供しない（SQ-20）。遷移の無期限の保持と、INSERT失敗時のロールバックは、フィードを提供するときだけ生じる。"
    }
  ],
  "notes": [
    {
      "topic": "同時書き込みの勝者",
      "reason": "実時間で競争する場面は結果が非決定的なため作らない。W-7・W-8は直列の重複・古い番号で、D-6はTransactionConflictの差し込みで検査する。"
    },
    {
      "topic": "メモリのS-3",
      "reason": "期限切れ方式は任意能力で、メモリのプロファイルは未合意である。v1のS-3はdynamodbだけを対象とし、メモリに能力の提供を要求しない。"
    },
    {
      "topic": "R-8",
      "reason": "DY-9の1回のBatchGetItemに対し、旧ヘッドを捕捉後に追記を確定し、返す応答を旧ヘッドと新スナップショットの組へ差し替える。メモリの原子性は未合意のプロファイルに委ねる。"
    },
    {
      "topic": "T-3とT-13の精度",
      "reason": "時刻の往復は言語の標準時刻型に変換した入力と比較し、丸め方向は定めない。境界はnanosecondsとmillisecondsの条件を付け、標準時刻型の精度に合う一方を実行する。"
    },
    {
      "topic": "負のseq_nr",
      "reason": "T-9の範囲外は契約違反として扱う（2026-10-05の指揮役回答）。符号なしの型で-1を表せない言語はsigned_seq_nrの印付きケースを表現不能として報告する。"
    },
    {
      "topic": "S-4の観測",
      "reason": "共通場面の履歴と失敗通知は実行器の明示的な保持・検査フックで観測する。物理的な属性名やTTLの期限はDynamoDBの場面にだけ期待する。"
    },
    {
      "topic": "DynamoDBの非番号付き手順",
      "reason": "設定照合、保持のページ送り・25件分割・未処理キーと項目の再要求・#ttlの期限はDY-8、D-3、D-9とS-2〜S-4に対応付ける。新しい規則番号は作らない。"
    },
    {
      "topic": "v1の範囲",
      "reason": "hash.mdが収録を要求するFNV-1a 64の4件はK-1として対象に含める。変更フィード、購読側の再同期、旧配置の移行、公開APIの型や不変性、K-2のキー埋め込みはv1の対象外である。"
    },
    {
      "topic": "ADR-0008の固定バイナリ封筒",
      "reason": "ADR-0008とBigtable仕様は各言語のエンコード・復元検証を求めるが、適合テストデータへの入出力表の収録は求めていない。v1は共通契約とDynamoDBを中心とするため、Bigtable固有の固定バイナリ封筒は対象外のままとする。"
    },
    {
      "topic": "段階5の保存先の同時実行",
      "reason": "2つの読み取りの間に別の接続が書く事例（R-8）と、本当に同時に走る競合は、SQLite・Spanner・Bigtableの共通のデータに入れない。実時間の競争は結果が非決定的で、保存先ごとに作る方法が異なるため、各言語の試験に任せる。共有した2つ目のストアでの直列の重複・古いseq_nrはW-7・W-8の場面で、SQLiteの書き込みのロックはholdWriteLockの場面で検査する。"
    },
    {
      "topic": "SQLiteのテーブルの形",
      "reason": "SQLiteのテーブルの形（テーブル・列・主キー・STRICT・config行の保存形式、SQ-2・SQ-16が照合する定義）は操作の場面で表せない。物理的な保存形式は適合テストデータの対象外とし、各言語の試験に任せる（ハブ #47 の決まったこと4）。データは論理的な設定の種まき（seed.configuration）で、記録した設定との食い違いだけを確かめる。"
    }
  ]
}
